row_number	crash_report_id	street_or_highway	nearest_intersection	traffic_control	type	type_of_roadway	address_sent_to_geocoder	lat_raw	lon_raw	lat_api_best	lon_api_best	distance_btwn_coords_meters	best_coords	reason_for_qa
1080	767003	MEMORIAL BLVD	STEEPLE ST	Traffic Control Signal	route	Two-Way, Divided, Unprotected (painted>4feet) Medium	Memorial Blvd and Steeple Street, Providence, RI, USA	41.82678	-71.41066	41.8273889	-71.409299	131.6814827	Not yet determined	distance greater than 100m
1071	768115	105 Harris Ave	ACORN ST	No Controls	street_address	Two-Way , Not Divided	105 Harris Ave, Providence, RI, USA	41.82607	-71.42889	41.8273632	-71.4233044	485.1822372	Not yet determined	distance greater than 100m
1064	769037	STEEPLE ST	MEMORIAL BLVD	Traffic Control Signal	route	Two-Way, Divided, Positive Median Barrier	Steeple Street and Memorial Blvd, Providence, RI, USA	41.82674	-71.41068	41.8263996	-71.4134258	230.8990517	Not yet determined	distance greater than 100m
1061	769159	CHARLES ST	195 NORTH ON RAMP	No Controls	route	One-Way Trafficway	Charles Street and 195 North On Ramp, Providence, RI, USA	41.83696	-71.41315	41.817505	-71.4167284	2185.967681	Not yet determined	distance greater than 100m
1032	777758	COLLEGE ST	COLLEGE ST	Traffic Control Signal	route	One-Way Trafficway	College Street and College Street, Providence, RI, USA	41.82564	-71.40784	41.8260241	-71.4066485	107.6901728	Raw	distance greater than 100m
1027	778414	N MAIN ST	N MAIN ST	No Controls	route	Two-Way, Divided, Unprotected (painted>4feet) Medium	N Main Street and N Main Street, Providence, RI, USA	41.83709	-71.4095	41.8256787	-71.4078251	1277.874235	Raw	distance greater than 100m
1026	778460	SMITH ST	ORMS ST	No Controls	intersection	Two-Way , Not Divided	Smith Street and Orms Street, Providence, RI, USA	41.83456	-71.42401	41.8337775	-71.4219437	192.2490257	Not yet determined	distance greater than 100m
1025	778867	BROAD ST	BROAD ST	Stop Signs	route	Two-Way , Not Divided	Broad Street and Broad Street, Providence, RI, USA	41.80648	-71.42002	41.7945838	-71.4101636	1556.513667	Raw	distance greater than 100m
1010	783053	Point St	Service road #8	Traffic Control Signal	route	One-Way Trafficway	Point Street and Service Road #8, Providence, RI, USA	41.81513	-71.41193	41.8158978	-71.4408471	2400.65566	Not yet determined	distance greater than 100m
1003	783947	BRANCH AVE EXIT	BRANCH AVE	Yield Signs	route	Two-Way , Not Divided	Branch Ave Exit and Branch Ave, Providence, RI, USA	41.85252	-71.42536	41.8515249	-71.4228521	235.6156623	Not yet determined	distance greater than 100m
1001	783971	BROAD ST	BROAD ST	Traffic Control Signal	route	Two-Way, Divided, Unprotected (painted>4feet) Medium	Broad Street and Broad Street, Providence, RI, USA	41.80977	-71.42101	41.7945838	-71.4101636	1915.197638	Raw	distance greater than 100m
997	784816	73 PHEBE ST	ADMIRAL ST	No Controls	premise	Two-Way , Not Divided	73 Phebe Street, Providence, RI, USA	41.83618	-71.41545	41.8526339	-71.4419725	2862.267402	Not yet determined	distance greater than 100m
990	785687	Branch Ave	Branch Ave Exit	No Controls	route	Two-Way, Divided, Positive Median Barrier	Branch Ave and Branch Ave Exit, Providence, RI, USA	41.8461	-71.4114	41.8515249	-71.4228521	1125.392148	Not yet determined	distance greater than 100m
967	788891	DEAN ST	KINSLEY AVE	No Controls	intersection	One-Way Trafficway	Dean Street and Kinsley Ave, Providence, RI, USA	41.82747	-71.42616	41.828859	-71.4264711	156.7613814	Not yet determined	distance greater than 100m
962	789511	CHARLES ST	CHARLES ST EXIT 23	Yield Signs	locality	One-Way Trafficway	Charles Street and Charles St Exit 23, Providence, RI, USA	41.83785	-71.41426	41.8239891	-71.4128343	1547.513321	Not yet determined	distance greater than 100m
951	790756	CHAD BROWN STREET	RADCLIFFE AVENUE	Stop Signs	intersection	Two-Way , Not Divided	Chad Brown Street and Radcliffe Avenue, Providence, RI, USA	41.83349	-71.41682	41.8393259	-71.4311219	1352.432837	Not yet determined	distance greater than 100m
949	790916	BROAD ST	LOCKWOOD ST	No Controls	route	Two-Way , Not Divided	Broad Street and Lockwood Street, Providence, RI, USA	41.81536	-71.42062	41.8129685	-71.4159924	467.2089484	Not yet determined	distance greater than 100m
943	791597	Plainfield Street	Union Street	Stop Signs	route	Two-Way, Divided, Unprotected (painted>4feet) Medium	Plainfield Street and Union Street, Providence, RI, USA	41.8088	-71.46314	41.823235	-71.4134849	4421.947513	Not yet determined	distance greater than 100m
940	792184	FRANCIS ST	AMERICAN EXPRESS PLZ	Traffic Control Signal	locality	Two-Way, Divided, Unprotected (painted>4feet) Medium	Francis Street and American Express Plz, Providence, RI, USA	41.82741	-71.41541	41.8239891	-71.4128343	436.6572833	Not yet determined	distance greater than 100m
937	792659	PONAGANSETT AVE / DRESSER ST	PONAGANSETT AVE	No Controls	establishment	Two-Way , Not Divided	Ponagansett Ave / Dresser Street and Ponagansett Ave, Providence, RI, USA	41.81979	-71.4584	41.84190254	-71.72369198	22142.16433	Not yet determined	distance greater than 100m
936	793135	HAUXHURST AVE	LAUREL HILL AVE	No Controls	route	One-Way Trafficway	Hauxhurst Ave and Laurel Hill Ave, Providence, RI, USA	41.82179	-71.4554	41.8067975	-71.4525408	1685.732086	Not yet determined	distance greater than 100m
928	794476	Elmwood Ave	Roger Williams Ave	No Controls	intersection	Two-Way, Divided, Unprotected (painted>4feet) Medium	Elmwood Ave and Roger Williams Ave, Providence, RI, USA	41.78767	-71.42041	41.7885278	-71.4209033	103.8978993	Not yet determined	distance greater than 100m
925	795002	BRANCH AVE	95 SOUTH ON-RAMP	No Controls	route	One-Way Trafficway	Branch Ave and 95 South On-Ramp, Providence, RI, USA	41.85064	-71.42521	41.8515249	-71.4228521	218.9299322	Not yet determined	distance greater than 100m
920	795544	SERVICE ROAD 8	BROAD ST	Traffic Control Signal	street_address	One-Way Trafficway	Service Road 8 and Broad Street, Providence, RI, USA	41.818	-71.41637	41.819365	-71.4149768	190.9147144	Not yet determined	distance greater than 100m
919	796617	GREENWICH ST	BUCKLIN ST	Traffic Control Signal	intersection	Two-Way , Not Divided	Greenwich Street and Bucklin Street, Providence, RI, USA	41.80237	-71.42609	41.8023399	-71.4276553	129.9364359	Not yet determined	distance greater than 100m
908	797245	310 Cranston Street	GILMORE ST	No Controls	premise	Two-Way , Not Divided	310 Cranston Street, Providence, RI, USA	41.81336	-71.4281	41.8126796	-71.4291479	115.3081381	Not yet determined	distance greater than 100m
906	797387	SERVICE ROAD 8	WESTMINSTER ST	Stop Signs	street_address	One-Way Trafficway	Service Road 8 and Westminster Street, Providence, RI, USA	41.81924	-71.41784	41.8252921	-71.4089265	1000.33184	Not yet determined	distance greater than 100m
891	798522	REDWING ST	BUCKLIN ST	Unknown	intersection	Two-Way , Not Divided	Redwing Street and Bucklin Street, Providence, RI, USA	41.79939	-71.42649	41.7992422	-71.4277346	104.5877338	Not yet determined	distance greater than 100m
882	799573	BROAD ST	MARLBOROUGH ST	No Controls	route	Two-Way , Not Divided	Broad Street and Marlborough Street, Providence, RI, USA	41.80572	-71.41978	41.7909266	-71.4457512	2712.426761	Not yet determined	distance greater than 100m
880	799790	Veazie Street	DOUGLAS AVE	No Controls	intersection	Two-Way , Not Divided	Veazie Street and Douglas Ave, Providence, RI, USA	41.85154	-71.43468	41.8505578	-71.4341761	117.0497545	Not yet determined	distance greater than 100m
877	800132	60 VALLEY ST	SAN SOUCI DR	No Controls	premise	Two-Way , Not Divided	60 Valley Street, Providence, RI, USA	41.81767	-71.44086	41.8189506	-71.4412852	146.8553867	Not yet determined	distance greater than 100m
875	800520	EDDY ST	EDDY ST EXIT	No Controls	route	Two-Way , Not Divided	Eddy Street and Eddy St Exit, Providence, RI, USA	41.81156	-71.40709	41.8059506	-71.4072274	624.5396181	Not yet determined	distance greater than 100m
874	800606	533 ELMWOOD AVE	533 ELMWOOD AVE	No Controls	premise	Two-Way , Not Divided	533 Elmwood Ave, Providence, RI, USA	41.79939	-71.42649	41.7976099	-71.4267799	199.6149138	Raw	distance greater than 100m
864	801458	HARTFORD AVE	HARTFORD AVE	Unknown	route	Two-Way, Divided, Unprotected (painted>4feet) Medium	Hartford Ave and Hartford Ave, Providence, RI, USA	41.81827	-71.45698	41.829423	-71.5357282	6649.500547	Raw	distance greater than 100m
861	802806	DUPONT DR	NIANTIC AVE	Traffic Control Signal	intersection	Two-Way , Not Divided	Dupont Dr and Niantic Ave, Providence, RI, USA	41.80066	-71.43901	41.796166	-71.439058	500.2856505	Not yet determined	distance greater than 100m
862	802844	BROAD ST	BROAD ST	Pavement Markings	route	Two-Way , Not Divided	Broad Street and Broad Street, Providence, RI, USA	41.81632	-71.41929	41.7945838	-71.4101636	2535.403226	Raw	distance greater than 100m
857	803027	N MAIN ST	RANDALL ST	No Controls	route	Two-Way, Divided, Positive Median Barrier	N Main Street and Randall Street, Providence, RI, USA	41.83888	-71.40937	41.837966	-71.4096299	104.0042065	Not yet determined	distance greater than 100m
851	805597	ROUTE 10 SOUTH RESERVOIR AVE EXIT	RESERVOIR AVE	Pavement Markings	route	One-Way Trafficway	Route 10 South Reservoir Ave Exit and Reservoir Ave, Providence, RI, USA	41.78762	-71.43257	41.779452	-71.4435523	1287.549862	Not yet determined	distance greater than 100m
849	805972	SOMERSET STREET	BROAD STREET	No Controls	locality	Two-Way , Not Divided	Somerset Street and Broad Street, Providence, RI, USA	41.81735	-71.45075	41.8134589	-71.421576	2458.904242	Not yet determined	distance greater than 100m
843	806494	FRANCIS ST	AMERICAN EXPRESS PLZ	Traffic Control Signal	locality	Two-Way , Not Divided	Francis Street and American Express Plz, Providence, RI, USA	41.82745	-71.41541	41.8239891	-71.4128343	440.545949	Not yet determined	distance greater than 100m
837	807337	EXIT 22A (RT )	FRANCIS ST	Traffic Control Signal	route	Two-Way, Divided, Positive Median Barrier	Exit 22a (Rt ) and Francis Street, Providence, RI, USA	41.82577	-71.41527	41.8284747	-71.4153409	301.1432612	Not yet determined	distance greater than 100m
829	807712	FRANCIS ST	AMERICAN EXPRESS PLZ	Traffic Control Signal	locality	Two-Way , Not Divided	Francis Street and American Express Plz, Providence, RI, USA	41.82745	-71.41541	41.8239891	-71.4128343	440.545949	Not yet determined	distance greater than 100m
820	808792	RICHMOND STREET	EDDY STREET	No Controls	intersection	Two-Way , Not Divided	Richmond Street and Eddy Street, Providence, RI, USA	41.83616	-71.41597	41.8156786	-71.4065248	2410.846369	Not yet determined	distance greater than 100m
818	808930	HARTFORD AVE	HARTFORD AVE	No Controls	route	Two-Way , Not Divided	Hartford Ave and Hartford Ave, Providence, RI, USA	41.81967	-71.46639	41.829423	-71.5357282	5853.464439	Raw	distance greater than 100m
811	809737	PLAINFIELD ST	PLAINFIELD ST	No Controls	route	Two-Way , Not Divided	Plainfield Street and Plainfield Street, Providence, RI, USA	41.81444	-71.447	41.8067161	-71.4643452	1676.456224	Raw	distance greater than 100m
809	810317	Manton Ave	Aleppo St	No Controls	intersection	Two-Way , Not Divided	Manton Ave and Aleppo Street, Providence, RI, USA	41.82019	-71.44695	41.8193627	-71.4462075	110.7959521	Not yet determined	distance greater than 100m
802	810989	POCASSET AVE	MAGNOLIA ST	No Controls	intersection	Two-Way , Not Divided	Pocasset Ave and Magnolia Street, Providence, RI, USA	41.81152	-71.4514	41.8119098	-71.4499342	129.1278102	Not yet determined	distance greater than 100m
796	811272	EXCHANGE TER	EXCHANGE ST	Stop Signs	intersection	One-Way Trafficway	Exchange Ter and Exchange Street, Providence, RI, USA	41.82611	-71.4116	41.8250247	-71.4148047	292.0046525	Not yet determined	distance greater than 100m
785	812530	NA	CRANSTON ST	Traffic Control Signal	route	Two-Way , Not Divided	NA and Cranston Street, Providence, RI, USA	41.80316	-71.43987	41.7959835	-71.4492555	1115.730813	Not yet determined	distance greater than 100m
782	812856	SERVICE ROAD 3	WESTMINSTER ST	No Controls	street_address	Two-Way , Not Divided	Service Road 3 and Westminster Street, Providence, RI, USA	41.81632	-71.44059	41.8252921	-71.4089265	2810.246105	Not yet determined	distance greater than 100m
781	812957	BROAD ST	BROAD ST	No Controls	route	Two-Way , Not Divided	Broad Street and Broad Street, Providence, RI, USA	41.81434	-71.42119	41.7945838	-71.4101636	2381.990146	Raw	distance greater than 100m
775	813355	douglas ave	DOUGLAS AVE	No Controls	intersection	Two-Way , Not Divided	Douglas Ave and Douglas Ave, Providence, RI, USA	41.83605	-71.41962	41.8715442	-71.4649957	5455.959475	Not yet determined	distance greater than 100m
762	815226	WASHINGTON ST	SERVICE ROAD 8	No Controls	street_address	Two-Way , Not Divided	Washington Street and Service Road 8, Providence, RI, USA	41.82021	-71.41885	41.7939064	-71.391257	3716.983824	Not yet determined	distance greater than 100m
756	815612	EAST DR	MIDDLE DR	No Controls	route	Two-Way , Not Divided	East Dr and Middle Dr, Providence, RI, USA	41.85234	-71.44313	41.8516951	-71.4439915	101.2752025	Not yet determined	distance greater than 100m
748	816048	PLAINFIELD ST EXIT	PLAINFIELD ST	Pavement Markings	route	Two-Way , Not Divided	Plainfield Street Exit and Plainfield Street, Providence, RI, USA	41.81539	-71.44587	41.8067161	-71.4643452	1811.676822	Not yet determined	distance greater than 100m
741	816246	NORTH MAIN ST	RANDALL ST	Pavement Markings	route	Two-Way, Divided, Positive Median Barrier	North Main Street and Randall Street, Providence, RI, USA	41.83666	-71.40959	41.837966	-71.4096299	145.4209122	Not yet determined	distance greater than 100m
738	816558	BROAD ST	BROAD ST	No Controls	route	Two-Way , Not Divided	Broad Street and Broad Street, Providence, RI, USA	41.81606	-71.41988	41.7945838	-71.4101636	2523.012651	Raw	distance greater than 100m
725	819705	77 Union Ave	SORRENTO ST	No Controls	premise	Two-Way , Not Divided	77 Union Ave, Providence, RI, USA	41.80984	-71.43621	41.8094521	-71.4382136	171.7621291	Not yet determined	distance greater than 100m
722	819863	OPPER STREET	SOCIAL STREET	Stop Signs	intersection	Two-Way , Not Divided	Opper Street and Social Street, Providence, RI, USA	41.83465	-71.41632	41.8538456	-71.4220131	2188.378981	Not yet determined	distance greater than 100m
709	821321	GALLATIN ST	EMERSON ST	No Controls	intersection	Two-Way , Not Divided	Gallatin Street and Emerson Street, Providence, RI, USA	41.79717	-71.41358	41.7966497	-71.4153701	159.4517786	Not yet determined	distance greater than 100m
703	821951	GROSVENOR AVE	CHALKSTONE AVE	No Controls	intersection	Two-Way, Divided, Unprotected (painted>4feet) Medium	Grosvenor Ave and Chalkstone Ave, Providence, RI, USA	41.83377	-71.43953	41.8323976	-71.439537	152.7759724	Not yet determined	distance greater than 100m
698	822281	ADELAIDE AVE	RESERVOIR AVE	Traffic Control Signal	intersection	Two-Way, Divided, Unprotected (painted>4feet) Medium	Adelaide Ave and Reservoir Ave, Providence, RI, USA	41.79275	-71.42748	41.7955254	-71.4262013	326.6744043	Not yet determined	distance greater than 100m
688	823236	CHARLES ST	CANAL ST	No Controls	route	Two-Way , Not Divided	Charles Street and Canal Street, Providence, RI, USA	41.83329	-71.41136	41.8300387	-71.4110637	362.7665221	Not yet determined	distance greater than 100m
679	824225	GANO ST EXIT	GANO ST	Traffic Control Signal	route	One-Way Trafficway	Gano Street Exit and Gano Street, Providence, RI, USA	41.82113	-71.38944	41.8238695	-71.3900983	309.8108346	Not yet determined	distance greater than 100m
677	824563	INDIA STREET	NA	No Controls	route	Two-Way , Not Divided	India Street, Providence, RI, USA	41.81823	-71.39259	41.8181038	-71.3951646	214.0566958	Not yet determined	distance greater than 100m
678	824576	F C GREENE MEMORIAL BLVD	F C GREENE MEMORIAL BLVD	No Controls	intersection	Two-Way , Not Divided	F C Greene Memorial Blvd and F C Greene Memorial Blvd, Providence, RI, USA	41.77945	-71.41418	41.7885473	-71.4142058	1012.709068	Raw	distance greater than 100m
669	824815	GANO ST	NA	No Controls	route	Two-Way , Not Divided	Gano Street, Providence, RI, USA	41.81876	-71.38931	41.8238695	-71.3900983	572.5340443	Not yet determined	distance greater than 100m
670	824824	BROAD ST	PARKSIDE CIR	Stop Signs	route	Two-Way , Not Divided	Broad Street and Parkside Cir, Providence, RI, USA	41.78589	-71.40166	41.7858514	-71.4036757	167.366943	Not yet determined	distance greater than 100m
671	825498	VALLEY ST	DEAN ST	No Controls	route	One-Way Trafficway	Valley Street and Dean Street, Providence, RI, USA	41.83139	-71.42848	41.8234078	-71.4242155	956.3985976	Not yet determined	distance greater than 100m
668	824854	336 Admiral Street	336 Admiral Street	No Controls	premise	Two-Way , Not Divided	336 Admiral Street, Providence, RI, USA	41.83616	-71.42824	41.8455374	-71.4273582	1046.445863	Raw	distance greater than 100m
663	825415	PLAINFIELD ST	ON RAMP TO RT 6 EAST	No Controls	premise	Two-Way, Divided, Unprotected (painted>4feet) Medium	Plainfield Street and On Ramp To Rt 6 East, Providence, RI, USA	41.81541	-71.44589	41.8224276	-71.3955012	4252.69684	Not yet determined	distance greater than 100m
653	827952	271 RESERVOIR AVE	271 RESERVOIR AVE	No Controls	premise	Two-Way, Divided, Unprotected (painted>4feet) Medium	271 Reservoir Ave, Providence, RI, USA	41.79216	-71.42783	41.7894913	-71.4300523	349.6797601	Raw	distance greater than 100m
651	828056	BROAD ST	CENTRAL ST	No Controls	intersection	Two-Way , Not Divided	Broad Street and Central Street, Providence, RI, USA	41.81323	-71.42189	41.8858281	-71.3870525	8582.371072	Not yet determined	distance greater than 100m
643	829641	WHITMARSH ST	UPDIKE ST	No Controls	intersection	Two-Way , Not Divided	Whitmarsh Street and Updike Street, Providence, RI, USA	41.80605	-71.42101	41.806023	-71.4224872	122.6122281	Not yet determined	distance greater than 100m
636	830080	MEMORIAL BLVD	STEEPLE ST	Traffic Control Signal	route	Two-Way, Divided, Unprotected (painted>4feet) Medium	Memorial Blvd and Steeple Street, Providence, RI, USA	41.82677	-71.41063	41.8273889	-71.409299	130.1401791	Not yet determined	distance greater than 100m
635	830241	502 HARTFORD AVE	MELISSA ST	Pavement Markings	premise	Two-Way , Not Divided	502 Hartford Ave, Providence, RI, USA	41.80864	-71.44081	41.8187363	-71.460615	1990.790711	Not yet determined	distance greater than 100m
619	832157	GANO ST	I 195 E	No Controls	street_address	Two-Way , Not Divided	Gano Street and I 195 E, Providence, RI, USA	41.81904	-71.38931	41.8256891	-71.390238	744.1671439	Not yet determined	distance greater than 100m
620	832181	SOUTH WATER ST	NA	No Controls	route	One-Way Trafficway	South Water Street, Providence, RI, USA	41.81771	-71.40083	41.8202174	-71.4039536	380.8701373	Not yet determined	distance greater than 100m
615	832735	CATHERDAL AVE	SMITH ST	No Controls	intersection	Two-Way , Not Divided	Catherdal Ave and Smith Street, Providence, RI, USA	41.8132	-71.45548	41.8444122	-71.4491246	3514.291226	Not yet determined	distance greater than 100m
595	834726	BROAD STREET	NA	No Controls	route	Two-Way , Not Divided	Broad Street, Providence, RI, USA	41.81455	-71.42107	41.7945838	-71.4101636	2399.817126	Not yet determined	distance greater than 100m
593	835050	DOUGLAS AVE	DOUGLAS AVE	No Controls	intersection	Two-Way , Not Divided	Douglas Ave and Douglas Ave, Providence, RI, USA	41.84183	-71.42751	41.8715442	-71.4649957	4538.856933	Raw	distance greater than 100m
587	835508	broad st	BROAD ST	No Controls	route	Two-Way , Not Divided	Broad Street and Broad Street, Providence, RI, USA	41.79944	-71.4162	41.7945838	-71.4101636	737.0198488	Not yet determined	distance greater than 100m
579	838630	BROAD ST	CHESTNUT ST	Traffic Control Signal	intersection	Two-Way , Not Divided	Broad Street and Chestnut Street, Providence, RI, USA	41.82003	-71.41432	41.8928375	-71.3876733	8400.627974	Not yet determined	distance greater than 100m
574	839700	WESTMINSTER ST	WESTMINSTER ST EXIT	No Controls	route	Two-Way , Not Divided	Westminster Street and Westminster St Exit, Providence, RI, USA	41.81598	-71.43959	41.8171825	-71.4257801	1153.525261	Not yet determined	distance greater than 100m
572	841122	CHARLES ST	CHARLES ST	No Controls	route	One-Way Trafficway	Charles Street and Charles Street, Providence, RI, USA	41.83673	-71.41283	41.8474982	-71.419539	1321.54211	Raw	distance greater than 100m
552	848583	W RIVER ST	BRANCH AVE	No Controls	intersection	Two-Way , Not Divided	W River Street and Branch Ave, Providence, RI, USA	41.84598	-71.41326	41.8468987	-71.4126689	113.4094551	Not yet determined	distance greater than 100m
542	849419	NORTH MAIN STREET	CHURCH ST	No Controls	intersection	One-Way Trafficway	North Main Street and Church Street, Providence, RI, USA	41.83071	-71.41035	41.8755687	-71.3912211	5239.491768	Not yet determined	distance greater than 100m
541	849507	FLORAL AVE	CLADRASH'S AVE	No Controls	locality	Two-Way , Not Divided	Floral Ave and Cladrash's Ave, Providence, RI, USA	41.78419	-71.40703	41.8239891	-71.4128343	4456.51924	Not yet determined	distance greater than 100m
540	849644	BROAD ST	BROAD ST	Pavement Markings	route	Two-Way , Not Divided	Broad Street and Broad Street, Providence, RI, USA	41.79929	-71.41603	41.7945838	-71.4101636	715.1837912	Raw	distance greater than 100m
535	850123	5 BRANCH AVE	DRYDEN LN	No Controls	premise	Two-Way , Not Divided	5 Branch Ave, Providence, RI, USA	41.84252	-71.4083	41.8438087	-71.4074401	160.2041676	Not yet determined	distance greater than 100m
530	851095	ATWELLS AVE AT DEAN ST	DEAN ST	Traffic Control Signal	route	Two-Way , Not Divided	Atwells Ave At Dean Street and Dean Street, Providence, RI, USA	41.82339	-71.4242	41.8244829	-71.4363598	1016.026523	Not yet determined	distance greater than 100m
511	853479	Francis Street	Fountain Street	Traffic Control Signal	route	Two-Way , Not Divided	Francis Street and Fountain Street, Providence, RI, USA	41.82492	-71.41462	33.9176699	-79.7489411	1143864.24	Not yet determined	distance greater than 100m
500	854337	51 Silver Spring Street	Charles Street	No Controls	premise	Unknown	51 Silver Spring Street, Providence, RI, USA	41.84501	-71.41842	41.8454522	-71.4166633	153.7705954	Not yet determined	distance greater than 100m
501	854356	FRANCIS ST	AMERICAN EXPRESS PLZ	No Controls	locality	Two-Way , Not Divided	Francis Street and American Express Plz, Providence, RI, USA	41.82745	-71.41541	41.8239891	-71.4128343	440.545949	Not yet determined	distance greater than 100m
499	854593	ABBOTT ST	ROYAL ST	No Controls	route	One-Way Trafficway	Abbott Street and Royal Street, Providence, RI, USA	41.81911	-71.3893	41.8434195	-71.4056432	3026.669711	Not yet determined	distance greater than 100m
494	854775	POWER ST	POWER ST	No Controls	route	One-Way Trafficway	Power Street and Power Street, Providence, RI, USA	41.82266	-71.40536	41.8232025	-71.3970049	695.7341975	Raw	distance greater than 100m
452	856892	355 Reservoir Ave	PONTIAC AVE	Traffic Control Signal	subpremise	Two-Way , Not Divided	355 Reservoir Ave, Providence, RI, USA	41.78819	-71.43152	41.7887759	-71.4327425	120.6225649	Not yet determined	distance greater than 100m
442	857672	PLEASANT ST	PLEASANT CT	Warning Signs	intersection	One-Way Trafficway	Pleasant Street and Pleasant Ct, Providence, RI, USA	41.8396	-71.40514	41.8596697	-71.4726318	6025.995359	Not yet determined	distance greater than 100m
441	857830	S WATER ST	NA	Traffic Control Signal	route	One-Way Trafficway	S Water Street, Providence, RI, USA	41.81877	-71.4019	41.8202174	-71.4039536	234.4914025	Not yet determined	distance greater than 100m
421	860829	FRANCIS ST	GASPEE ST	Traffic Control Signal	route	Two-Way, Divided, Positive Median Barrier	Francis Street and Gaspee Street, Providence, RI, USA	41.82897	-71.4153	41.8298918	-71.413218	200.8833518	Not yet determined	distance greater than 100m
422	860830	EXIT 22A (RT )	FRANCIS ST	Traffic Control Signal	route	Two-Way, Divided, Positive Median Barrier	Exit 22a (Rt ) and Francis Street, Providence, RI, USA	41.82577	-71.41527	41.8284747	-71.4153409	301.1432612	Not yet determined	distance greater than 100m
404	862096	SMITHFIELD AVE	SMITHFIELD AVE	Traffic Control Signal	intersection	One-Way Trafficway	Smithfield Ave and Smithfield Ave, Providence, RI, USA	41.8558	-71.40766	41.8563993	-71.4524031	3710.398732	Raw	distance greater than 100m
396	862467	BLACKSTONE BLVD	EAST AVE	No Controls	route	Two-Way, Divided, Positive Median Barrier	Blackstone Blvd and East Ave, Providence, RI, USA	41.85657	-71.39103	41.8450883	-71.3870926	1319.17769	Not yet determined	distance greater than 100m
393	862555	ADELAIDE AVE	HAMILTON ST	Stop Signs	intersection	Two-Way , Not Divided	Adelaide Ave and Hamilton Street, Providence, RI, USA	41.80357	-71.42571	41.7973969	-71.4201379	828.2762058	Not yet determined	distance greater than 100m
395	862566	HAGAN ST	MENDON ST	No Controls	route	Two-Way , Not Divided	Hagan Street and Mendon Street, Providence, RI, USA	41.85692	-71.4224	41.8556752	-71.4226281	139.8551593	Not yet determined	distance greater than 100m
381	863608	DORRANCE ST	EXCHANGE TER	Traffic Control Signal	route	Two-Way , Not Divided	Dorrance Street and Exchange Ter, Providence, RI, USA	41.82482	-71.41415	41.825713	-71.4127397	153.5201614	Not yet determined	distance greater than 100m
379	863985	CHARLES ST	EXIT  (RT 146N )	Pavement Markings	locality	Two-Way , Not Divided	Charles Street and Exit  (Rt 146n ), Providence, RI, USA	41.8422	-71.41799	41.8239891	-71.4128343	2071.840048	Not yet determined	distance greater than 100m
362	865229	BROAD ST	BROAD ST	Pavement Markings	route	Two-Way , Not Divided	Broad Street and Broad Street, Providence, RI, USA	41.78805	-71.40335	41.7945838	-71.4101636	921.3164977	Raw	distance greater than 100m
354	866350	PLAINFIELD ST	PLAINFIELD ST	No Controls	route	Two-Way , Not Divided	Plainfield Street and Plainfield Street, Providence, RI, USA	41.8146	-71.44679	41.8067161	-71.4643452	1700.559471	Raw	distance greater than 100m
