row_number	crash_report_id	street_or_highway	nearest_intersection	traffic_control	type	type_of_roadway	address_sent_to_geocoder	lat_raw	lon_raw	lat_api_best	lon_api_best	distance_btwn_coords_meters	best_coords	reason_for_qa
1657	571007	DOUGLAS AVE	LUBEC ST	No Controls	intersection	Two-Way, Divided, Unprotected (painted>4feet) Medium	Douglas Ave and Lubec Street, Providence, RI, USA	41.84258	-71.44515	41.8557294	-71.4416833	1491.744706	Not yet determined	distance greater than 100m
1655	572160	I 95 N	DOUGLAS AVE	No Controls	street_address	Two-Way , Not Divided	I 95 N and Douglas Ave, Providence, RI, USA	41.8347	-71.41607	41.8361835	-71.4192655	312.274919	Not yet determined	distance greater than 100m
1649	575796	Huntington Ave	NA	No Controls	route	One-Way Trafficway	Huntington Ave, Providence, RI, USA	41.80394	-71.43901	41.8025522	-71.4361117	285.8498295	Not yet determined	distance greater than 100m
1642	578795	US HWY 6 E	WESTMINSTER ST	Traffic Control Signal	street_address	One-Way Trafficway	Us Hwy 6 E and Westminster Street, Providence, RI, USA	41.81576	-71.43875	41.8252921	-71.4089265	2692.084978	Not yet determined	distance greater than 100m
1635	582589	BUTLER DR	BLACKSTONE BLVD	Other	route	Two-Way , Not Divided	Butler Dr and Blackstone Blvd, Providence, RI, USA	41.84622	-71.38698	41.8450883	-71.3870926	126.3258405	Not yet determined	distance greater than 100m
1636	582950	RIVER AVE	ADMIRAL ST	Traffic Control Signal	intersection	Two-Way, Divided, Unprotected (painted>4feet) Medium	River Ave and Admiral Street, Providence, RI, USA	41.8492	-71.43894	41.853176	-71.4460552	737.5559085	Not yet determined	distance greater than 100m
1634	583797	ELMWOOD AVE	ELMWOOD AVE	No Controls	route	Two-Way , Not Divided	Elmwood Ave and Elmwood Ave, Providence, RI, USA	41.80965	-71.42421	41.7920613	-71.4229658	1960.685585	Raw	distance greater than 100m
1629	585911	CHALKSTONE AVENU	FERN STREET	No Controls	intersection	Two-Way , Not Divided	Chalkstone Avenu and Fern Street, Providence, RI, USA	41.81541	-71.44637	41.8328452	-71.4378466	2065.656017	Not yet determined	distance greater than 100m
1627	586115	BELMONT AVE	ACADEMY AVE	Other	intersection	One-Way Trafficway	Belmont Ave and Academy Ave, Providence, RI, USA	41.81438	-71.445	41.8322837	-71.4445179	1993.431985	Not yet determined	distance greater than 100m
1617	588502	FRANCIS STREET	I 95	Traffic Control Signal	route	Two-Way , Not Divided	Francis Street and I 95, Providence, RI, USA	41.83572	-71.41578	41.817505	-71.4167284	2029.210116	Not yet determined	distance greater than 100m
1616	588942	NORTH MAIN ST	N MAIN ST	No Controls	intersection	Two-Way, Divided, Positive Median Barrier	North Main Street and N Main Street, Providence, RI, USA	41.83926	-71.40902	41.9595187	-71.700964	27646.94475	Not yet determined	distance greater than 100m
1613	589045	UNION AVE	UNION AVE ON RAMP	Pavement Markings	route	Two-Way , Not Divided	Union Ave and Union Ave On Ramp, Providence, RI, USA	41.80893	-71.44004	41.8065901	-71.4484592	745.5720264	Not yet determined	distance greater than 100m
1611	589805	OSBORN ST	CHALKSTONE AVE	No Controls	intersection	Two-Way , Not Divided	Osborn Street and Chalkstone Ave, Providence, RI, USA	41.83759	-71.42538	41.8355026	-71.4246148	240.8792084	Not yet determined	distance greater than 100m
1607	590468	W EXCHANGE ST	W EXCHANGE ST EXIT 22A	Traffic Control Signal	route	One-Way Trafficway	W Exchange Street and W Exchange St Exit 22a, Providence, RI, USA	41.82485	-71.41611	41.825222	-71.4202531	346.1707955	Not yet determined	distance greater than 100m
1600	592707	N MAIN ST	CEMETERY ST	Traffic Control Signal	route	Two-Way , Not Divided	N Main Street and Cemetery Street, Providence, RI, USA	41.84681	-71.40519	41.8490626	-71.4037506	277.7169166	Not yet determined	distance greater than 100m
1601	592765	DOUGLAS AVE	DOUGLAS AVE	No Controls	intersection	Two-Way , Not Divided	Douglas Ave and Douglas Ave, Providence, RI, USA	41.83717	-71.4223	41.8715442	-71.4649957	5212.9477	Raw	distance greater than 100m
1594	595993	SERVICE ROAD 3	WESTMINSTER ST	Stop Signs	street_address	Two-Way , Not Divided	Service Road 3 and Westminster Street, Providence, RI, USA	41.81632	-71.44059	41.8252921	-71.4089265	2810.246105	Not yet determined	distance greater than 100m
1588	598305	N MAIN ST	WALGREENS PHARMACY PARKING LOT	No Controls	locality	Unknown	N Main Street and Walgreens Pharmacy Parking Lot, Providence, RI, USA	41.85174	-71.40213	41.8239891	-71.4128343	3214.251511	Not yet determined	distance greater than 100m
1573	604855	100 FRANCIS ST	NA	No Controls	street_address	Two-Way , Not Divided	100 Francis Street, Providence, RI, USA	41.82971	-71.41594	41.8260966	-71.415882	402.270619	Not yet determined	distance greater than 100m
1567	609208	cranston st	BURGESS ST	Pavement Markings	route	Two-Way , Not Divided	Cranston Street and Burgess Street, Providence, RI, USA	41.81518	-71.42502	41.8978375	-71.3504737	11084.60066	Not yet determined	distance greater than 100m
1565	610375	FRANCIS ST	GASPEE ST	No Controls	route	Two-Way, Not Divided With a Continuous Left Turn Lane	Francis Street and Gaspee Street, Providence, RI, USA	41.82916	-71.41506	41.8298918	-71.413218	173.1503237	Not yet determined	distance greater than 100m
1559	617447	EXIT 22A (RT )	FRANCIS ST	Traffic Control Signal	route	Two-Way , Not Divided	Exit 22a (Rt ) and Francis Street, Providence, RI, USA	41.82577	-71.41527	41.8284747	-71.4153409	301.1432612	Not yet determined	distance greater than 100m
1556	618207	RANKIN STREET	WHITFORD STREET	Stop Signs	route	Two-Way , Not Divided	Rankin Street and Whitford Street, Providence, RI, USA	41.8386	-71.43575	41.839134	-71.441124	449.6429491	Not yet determined	distance greater than 100m
1554	619243	CRARY STREET	EDDY STREET	Traffic Control Signal	route	One-Way Trafficway	Crary Street and Eddy Street, Providence, RI, USA	41.82004	-71.43725	41.8059506	-71.4072274	2943.601594	Not yet determined	distance greater than 100m
1549	620603	WARRINGTON AVE	ELMWOOD AVE	Stop Signs	intersection	Two-Way, Divided, Positive Median Barrier	Warrington Ave and Elmwood Ave, Providence, RI, USA	41.82267	-71.46053	41.7933302	-71.4236779	4474.109814	Not yet determined	distance greater than 100m
1552	620994	EXIT 22A (RT )	FRANCIS ST	Traffic Control Signal	route	One-Way Trafficway	Exit 22a (Rt ) and Francis Street, Providence, RI, USA	41.82577	-71.41527	41.8284747	-71.4153409	301.1432612	Not yet determined	distance greater than 100m
1542	623878	EXCHANGE TER	Dorrance St	Traffic Control Signal	route	Two-Way, Divided, Positive Median Barrier	Exchange Ter and Dorrance Street, Providence, RI, USA	41.82503	-71.4148	41.8233534	-71.4113407	342.3197457	Not yet determined	distance greater than 100m
1537	625212	1000 Elmwood Ave	ROSE AVE	No Controls	street_address	Two-Way, Divided, Unprotected (painted>4feet) Medium	1000 Elmwood Ave, Providence, RI, USA	41.78427	-71.41877	41.7792003	-71.4202862	578.2203045	Not yet determined	distance greater than 100m
1524	629952	UNION AVE	RT 10 NORTH ON RAMP	Traffic Control Signal	route	One-Way Trafficway	Union Ave and Rt 10 North On Ramp, Providence, RI, USA	41.8088	-71.44022	41.8332697	-71.4869184	4735.834111	Not yet determined	distance greater than 100m
1521	631403	WESTMINSTER ST	SERVICE ROAD 8	No Controls	intersection	One-Way Trafficway	Westminster Street and Service Road 8, Providence, RI, USA	41.81923	-71.41782	41.816332	-71.4406099	1918.042679	Not yet determined	distance greater than 100m
1520	631767	MERINO ST/ HARTFORD AVE	CROWNINSHIELD ST	No Controls	route	Two-Way , Not Divided	Merino St/ Hartford Ave and Crowninshield Street, Providence, RI, USA	41.81863	-71.45912	41.8177449	-71.4582059	124.3343713	Not yet determined	distance greater than 100m
1515	633009	361 RESERVOIR AVE	PONTIAC AVE	No Controls	street_address	Unknown	361 Reservoir Ave, Providence, RI, USA	41.78767	-71.43147	41.7885339	-71.4330063	159.7139721	Not yet determined	distance greater than 100m
1509	633885	85 WATERMAN STREET	BROWN ST	No Controls	premise	One-Way Trafficway	85 Waterman Street, Providence, RI, USA	41.82699	-71.403809999999993	41.8269146	-71.4019165	157.2920091	Not yet determined	distance greater than 100m
1508	634351	BROADWAY	GREENMAN LN	Traffic Control Signal	doctor	Two-Way , Not Divided	Broadway and Greenman Ln, Providence, RI, USA	41.82232	-71.41867	41.8109879	-71.4119953	1377.677046	Not yet determined	distance greater than 100m
1505	638374	CHALKSTONE AVENUE	ACADEMY AVENUE	Traffic Control Signal	intersection	Two-Way , Not Divided	Chalkstone Avenue and Academy Avenue, Providence, RI, USA	41.814	-71.44182	41.8324538	-71.4445249	2066.486194	Not yet determined	distance greater than 100m
1494	642847	WASHINGTON ST	CANAL ST	Stop Signs	locality	One-Way Trafficway	Washington Street and Canal Street, Providence, RI, USA	41.82673	-71.40939	41.8239891	-71.4128343	418.0058742	Not yet determined	distance greater than 100m
1490	643195	MEMORIAL BLVD	STEEPLE ST	Traffic Control Signal	route	Two-Way, Divided, Positive Median Barrier	Memorial Blvd and Steeple Street, Providence, RI, USA	41.82677	-71.41063	41.8273889	-71.409299	130.1401791	Not yet determined	distance greater than 100m
1488	646088	CHALKSTONE AVENUE	GROVESNOR STREET	No Controls	intersection	Two-Way , Not Divided	Chalkstone Avenue and Grovesnor Street, Providence, RI, USA	41.82529	-71.42985	41.8323976	-71.439537	1127.683601	Not yet determined	distance greater than 100m
1466	654095	FOUNTAIN ST	FRANCIS ST	Traffic Control Signal	route	Two-Way , Not Divided	Fountain Street and Francis Street, Providence, RI, USA	41.82498	-71.41474	33.9176699	-79.7489411	1143862.46	Not yet determined	distance greater than 100m
1464	656989	AMERICAN EXPRESS PLZ	FRANCIS ST	Traffic Control Signal	route	Two-Way , Not Divided	American Express Plz and Francis Street, Providence, RI, USA	41.82744	-71.41526	41.8284747	-71.4153409	115.3775959	Not yet determined	distance greater than 100m
1458	659779	FRUIT HILL AVE	HUBER AVE	No Controls	intersection	Two-Way, Divided, Unprotected (painted>4feet) Medium	Fruit Hill Ave and Huber Ave, Providence, RI, USA	41.83569	-71.4684	41.8345861	-71.4680712	125.8751983	Not yet determined	distance greater than 100m
1449	661527	Manton Ave	NA	Traffic Control Signal	route	Two-Way , Not Divided	Manton Ave, Providence, RI, USA	41.82537	-71.45463	41.8257711	-71.4570108	202.4786814	Not yet determined	distance greater than 100m
1448	665445	Westminster St	WESTMINSTER ST EXIT	No Controls	route	Two-Way , Not Divided	Westminster Street and Westminster St Exit, Providence, RI, USA	41.81578	-71.43823	41.8171825	-71.4257801	1044.634488	Not yet determined	distance greater than 100m
1446	666156	50 KENNEDY PLZ	DORRANCE ST	No Controls	premise	Two-Way, Divided, Unprotected (painted>4feet) Medium	50 Kennedy Plz, Providence, RI, USA	41.82425	-71.4122	41.8248966	-71.4105943	151.403818	Not yet determined	distance greater than 100m
1442	666520	10 PARK ROW	NA	No Controls	street_address	Two-Way , Not Divided	10 Park Row, Providence, RI, USA	41.83618	-71.41545	41.828997	-71.411454	865.5792989	Not yet determined	distance greater than 100m
1434	675451	CROMWELL ST	BUCKLIN ST	Stop Signs	intersection	Two-Way, Divided, Unprotected (painted>4feet) Medium	Cromwell Street and Bucklin Street, Providence, RI, USA	41.80878	-71.42463	41.8090645	-71.4280139	282.5577455	Not yet determined	distance greater than 100m
1431	678070	EXCHANGE TER	EXCHANGE ST	No Controls	intersection	Two-Way , Not Divided	Exchange Ter and Exchange Street, Providence, RI, USA	41.82581	-71.41246	41.8250247	-71.4148047	213.2425946	Not yet determined	distance greater than 100m
1428	681016	BROAD ST	BROAD ST	No Controls	route	Two-Way, Divided, Unprotected (painted>4feet) Medium	Broad Street and Broad Street, Providence, RI, USA	41.81348	-71.42158	41.7945838	-71.4101636	2306.996629	Raw	distance greater than 100m
1419	687837	HARTFORD AVE	MANTON AVE	Traffic Control Signal	route	One-Way Trafficway	Hartford Ave and Manton Ave, Providence, RI, USA	41.81685	-71.44356	41.8257711	-71.4570108	1493.776757	Not yet determined	distance greater than 100m
1402	698399	CHARLES ST	CHARLES ST	No Controls	route	Two-Way , Not Divided	Charles Street and Charles Street, Providence, RI, USA	41.85245	-71.42032	41.8474982	-71.419539	555.0230715	Raw	distance greater than 100m
1400	698978	SMITHFIELD AVE	SMITHFIELD AVE	No Controls	intersection	Two-Way, Divided, Unprotected (painted>4feet) Medium	Smithfield Ave and Smithfield Ave, Providence, RI, USA	41.85868	-71.41096	41.8563993	-71.4524031	3445.474386	Raw	distance greater than 100m
1399	704133	DOUGLAS AVENUE	EATON STREET	Traffic Control Signal	intersection	Two-Way , Not Divided	Douglas Avenue and Eaton Street, Providence, RI, USA	41.83457	-71.41644	41.8410051	-71.4273088	1151.403312	Not yet determined	distance greater than 100m
1394	699965	BROAD ST	BROAD ST	No Controls	route	Two-Way , Not Divided	Broad Street and Broad Street, Providence, RI, USA	41.79215	-71.40714	41.7945838	-71.4101636	369.2896541	Raw	distance greater than 100m
1389	702124	BROAD ST	BROAD ST	No Controls	route	Two-Way , Not Divided	Broad Street and Broad Street, Providence, RI, USA	41.79692	-71.41307	41.7945838	-71.4101636	354.7029467	Raw	distance greater than 100m
1380	706159	ATLANTIC AVE	NIAGARA ST	No Controls	intersection	Two-Way , Not Divided	Atlantic Ave and Niagara Street, Providence, RI, USA	41.79925	-71.41661	41.7986319	-71.4186449	182.3506688	Not yet determined	distance greater than 100m
1370	715886	BROADWAY	SERVICE ROAD 8	Traffic Control Signal	street_address	Two-Way , Not Divided	Broadway and Service Road 8, Providence, RI, USA	41.82212	-71.41976	41.7939064	-71.391257	3931.618819	Not yet determined	distance greater than 100m
1366	717576	BROAD ST	BROAD ST	Pavement Markings	route	Two-Way, Divided, Unprotected (painted>4feet) Medium	Broad Street and Broad Street, Providence, RI, USA	41.80572	-71.41978	41.7945838	-71.4101636	1474.327094	Raw	distance greater than 100m
1367	717770	DOUGLAS AVE	DOUGLAS AVE	No Controls	intersection	Two-Way , Not Divided	Douglas Ave and Douglas Ave, Providence, RI, USA	41.83567	-71.41871	41.8715442	-71.4649957	5538.692898	Raw	distance greater than 100m
1360	724398	235 Eaton St	RADCLIFFE AVE	No Controls	street_address	Two-Way , Not Divided	235 Eaton Street, Providence, RI, USA	41.84115	-71.43001	41.8418768	-71.436298	527.7168605	Not yet determined	distance greater than 100m
1353	726550	BROAD ST	OXFORD ST	No Controls	route	Two-Way , Not Divided	Broad Street and Oxford Street, Providence, RI, USA	41.79962	-71.41642	41.8004502	-71.417447	125.7161649	Not yet determined	distance greater than 100m
1352	726621	62 DUDLEY ST	NA	No Controls	street_address	Unknown	62 Dudley Street, Providence, RI, USA	41.80731	-71.40725	41.8101086	-71.40962	368.412328	Not yet determined	distance greater than 100m
1345	728178	601 N MAIN ST	NA	No Controls	subpremise	Two-Way , Not Divided	601 N Main Street, Providence, RI, USA	41.83825	-71.40925	41.8372393	-71.4083214	136.3451844	Not yet determined	distance greater than 100m
1341	729290	PACKET ST	S MAIN ST	Stop Signs	route	Two-Way , Not Divided	Packet Street and S Main Street, Providence, RI, USA	41.8235	-71.40617	41.8208275	-71.4037098	360.7775045	Not yet determined	distance greater than 100m
1336	732229	7TH ST	HIGHLAND AVE	Stop Signs	intersection	Two-Way , Not Divided	7th Street and Highland Ave, Providence, RI, USA	41.83793	-71.42404	41.8529679	-71.3990119	2666.467532	Not yet determined	distance greater than 100m
1325	733161	387 CHARLES ST	EXIT  (RT )	Traffic Control Signal	street_address	Two-Way , Not Divided	387 Charles Street, Providence, RI, USA	41.84224	-71.41786	41.843616	-71.417562	155.1564225	Not yet determined	distance greater than 100m
1326	733233	DEXTERDALE RD	CAMP ST	No Controls	intersection	Two-Way , Not Divided	Dexterdale Rd and Camp Street, Providence, RI, USA	41.84786	-71.40251	41.84774	-71.400772	144.7398017	Not yet determined	distance greater than 100m
1320	733789	POINT ST	GLOBE ST	Stop Signs	route	Two-Way, Divided, Unprotected (painted>4feet) Medium	Point Street and Globe Street, Providence, RI, USA	41.81566	-71.4095	41.8145617	-71.4072712	221.6795483	Not yet determined	distance greater than 100m
1316	735975	BROOM ST	EDDY ST	Stop Signs	intersection	Two-Way, Not Divided With a Continuous Left Turn Lane	Broom Street and Eddy Street, Providence, RI, USA	41.79052	-71.40477	41.7907663	-71.4032824	126.4756727	Not yet determined	distance greater than 100m
1314	736288	195 EAST ON-RAMP	SOUTH MAIN ST	Other	route	One-Way Trafficway	195 East On-Ramp, Providence, RI, USA	41.81686	-71.39849	41.8503946	-71.4343599	4773.587484	Not yet determined	distance greater than 100m
1312	737021	Broad St	BROAD ST	No Controls	route	Two-Way , Not Divided	Broad Street and Broad Street, Providence, RI, USA	41.80158	-71.41841	41.7945838	-71.4101636	1036.770898	Not yet determined	distance greater than 100m
1302	737803	ORMS ST	ORMS ST EXIT  / DOUGLAS AVE	No Controls	route	Two-Way , Not Divided	Orms Street and Orms St Exit  / Douglas Ave, Providence, RI, USA	41.83457	-71.41674	41.84894	-71.4323426	2057.48175	Not yet determined	distance greater than 100m
1297	738846	60 Prairie Ave	PROVIDENCE ST	No Controls	premise	Two-Way , Not Divided	60 Prairie Ave, Providence, RI, USA	41.81352	-71.41521	41.811976	-71.4149313	173.4257909	Not yet determined	distance greater than 100m
1293	739095	eddy Stree	I 195 RELOCATION	Traffic Control Signal	route	Two-Way , Not Divided	Eddy Stree and I 195 Relocation, Providence, RI, USA	41.80944	-71.40722	41.8059506	-71.4072274	388.4387165	Not yet determined	distance greater than 100m
1285	746967	THERESA CT	MANTON AVE	No Controls	route	Two-Way, Divided, Positive Median Barrier	Theresa Ct and Manton Ave, Providence, RI, USA	41.82154	-71.44863	41.8257711	-71.4570108	839.7575152	Not yet determined	distance greater than 100m
1279	743342	850 MANTON AVENUE	CHALKSTONE AVE	No Controls	premise	Two-Way , Not Divided	850 Manton Avenue, Providence, RI, USA	41.83391	-71.46725	41.8329814	-71.4659043	152.1306859	Not yet determined	distance greater than 100m
1275	744028	Smith St	SMITH ST	Stop Signs	route	Two-Way , Not Divided	Smith Street and Smith Street, Providence, RI, USA	41.83756	-71.43347	41.8418141	-71.4433053	943.1901946	Not yet determined	distance greater than 100m
1267	744714	BEACHMONT AVE	CAHILL ST	Stop Signs	route	Two-Way , Not Divided	Beachmont Ave and Cahill Street, Providence, RI, USA	41.80223	-71.40786	41.8037453	-71.4084995	176.8329016	Not yet determined	distance greater than 100m
1263	744924	ELMWOOD AVE	ELMWOOD AVE	No Controls	route	Two-Way, Not Divided With a Continuous Left Turn Lane	Elmwood Ave and Elmwood Ave, Providence, RI, USA	41.80337	-71.42577	41.7920613	-71.4229658	1280.208247	Raw	distance greater than 100m
1249	745406	STATE HWY 10 N	UNION AVE	Traffic Control Signal	street_address	Two-Way, Divided, Positive Median Barrier	State Hwy 10 N and Union Ave, Providence, RI, USA	41.8087	-71.44057	41.8100615	-71.4354863	448.21659	Not yet determined	distance greater than 100m
1238	746891	PLAINFIELD ST	RT 6 EAST RAMP	Traffic Control Signal	street_address	Two-Way, Divided, Unprotected (painted>4feet) Medium	Plainfield Street and Rt 6 East Ramp, Providence, RI, USA	41.81414	-71.44737	41.8166485	-71.4439495	398.1355492	Not yet determined	distance greater than 100m
1239	746920	RANDALL ST	CHARLES ST	Pavement Markings	route	One-Way Trafficway	Randall Street and Charles Street, Providence, RI, USA	41.82047	-71.45178	41.8361618	-71.4121277	3724.205722	Not yet determined	distance greater than 100m
1234	747151	EXIT 22A (RT )	FRANCIS ST	Traffic Control Signal	route	One-Way Trafficway	Exit 22a (Rt ) and Francis Street, Providence, RI, USA	41.82577	-71.41527	41.8284747	-71.4153409	301.1432612	Not yet determined	distance greater than 100m
1236	747674	445 Smith St	SMITH ST	Pavement Markings	premise	Two-Way, Divided, Unprotected (painted>4feet) Medium	445 Smith Street, Providence, RI, USA	41.83266	-71.4192	41.8354552	-71.4258315	631.9436284	Not yet determined	distance greater than 100m
1224	747952	North Main St	N MAIN ST	Stop Signs	intersection	One-Way Trafficway	North Main Street and N Main Street, Providence, RI, USA	41.83014	-71.41016	41.9595187	-71.700964	28072.91159	Not yet determined	distance greater than 100m
1211	748576	172 Roanoke Street	CARLETON ST	No Controls	street_address	Two-Way , Not Divided	172 Roanoke Street, Providence, RI, USA	41.83139	-71.44787	41.8309595	-71.4511285	274.4940577	Not yet determined	distance greater than 100m
1206	748636	ASHBURTON ST	ASHBURTON ST	No Controls	locality	One-Way Trafficway	Ashburton Street and Ashburton Street, Providence, RI, USA	41.83665	-71.41407	-43.905386	171.7447855	15008478.05	Raw	distance greater than 100m
1197	749010	WILLIAMS ST	S WATER ST	Stop Signs	route	One-Way Trafficway	Williams Street and S Water Street, Providence, RI, USA	41.82157	-71.40438	41.8202174	-71.4039536	154.6701231	Not yet determined	distance greater than 100m
1194	749512	WASHINGTON ST	EXCHANGE ST	No Controls	route	One-Way Trafficway	Washington Street and Exchange Street, Providence, RI, USA	41.8246	-71.41254	41.8257255	-71.4110379	176.7026982	Not yet determined	distance greater than 100m
1188	749877	MERINO ST	CROWNINSHIELD ST	No Controls	intersection	Two-Way, Divided, Unprotected (painted>4feet) Medium	Merino Street and Crowninshield Street, Providence, RI, USA	41.81852	-71.45909	41.8172	-71.458626	151.9003589	Not yet determined	distance greater than 100m
1189	749882	ALVERSON AVE	NYE ST	No Controls	intersection	Two-Way, Divided, Unprotected (painted>4feet) Medium	Alverson Ave and Nye Street, Providence, RI, USA	41.81874	-71.46007	41.8169709	-71.4594499	203.5439361	Not yet determined	distance greater than 100m
1176	751985	731 Eddy Street	NA	No Controls	premise	Two-Way , Not Divided	731 Eddy Street, Providence, RI, USA	41.8087	-71.40723	41.8078196	-71.4075635	101.8374567	Not yet determined	distance greater than 100m
1167	752544	EAST RIVER ST	WATERMAN ST	No Controls	route	Two-Way , Not Divided	East River Street and Waterman Street, Providence, RI, USA	41.82768	-71.3814	41.8276277	-71.394672	1100.930279	Not yet determined	distance greater than 100m
1160	752842	Memorial Blvd	EXIT 22A  (RT )	Traffic Control Signal	locality	Two-Way, Divided, Positive Median Barrier	Memorial Blvd and Exit 22a  (Rt ), Providence, RI, USA	41.82583	-71.41506	41.8239891	-71.4128343	275.8329143	Not yet determined	distance greater than 100m
1161	752870	RANDALL ST	CHARLES ST	No Controls	route	Two-Way , Not Divided	Randall Street and Charles Street, Providence, RI, USA	41.83761	-71.41032	41.8361618	-71.4121277	220.1541016	Not yet determined	distance greater than 100m
1146	756058	ELMA ST	PRAIRIE AVE	No Controls	intersection	One-Way Trafficway	Elma Street and Prairie Ave, Providence, RI, USA	41.79695	-71.4129	41.7972648	-71.4112689	139.8270718	Not yet determined	distance greater than 100m
1143	756671	EXIT 22A (RT )	FRANCIS ST	Traffic Control Signal	route	Two-Way , Not Divided	Exit 22a (Rt ) and Francis Street, Providence, RI, USA	41.82577	-71.41527	41.8284747	-71.4153409	301.1432612	Not yet determined	distance greater than 100m
1141	756883	DYER STREET	DORRANCE STREET	No Controls	intersection	Two-Way, Divided, Unprotected (painted>4feet) Medium	Dyer Street and Dorrance Street, Providence, RI, USA	41.80338	-71.40157	41.8212095	-71.4081639	2058.793307	Not yet determined	distance greater than 100m
1127	760262	100 francis st	AMERICAN EXPRESS PLZ	No Controls	street_address	Two-Way , Not Divided	100 Francis Street, Providence, RI, USA	41.8279	-71.41534	41.8260966	-71.415882	205.7263934	Not yet determined	distance greater than 100m
1123	760439	PLAINFIELD ST	PLAINFIELD ST	No Controls	route	Two-Way , Not Divided	Plainfield Street and Plainfield Street, Providence, RI, USA	41.81414	-71.44737	41.8067161	-71.4643452	1633.027628	Raw	distance greater than 100m
1124	760462	S WATER ST	S WATER ST	Other	route	One-Way Trafficway	S Water Street and S Water Street, Providence, RI, USA	41.82276	-71.40639	41.8202174	-71.4039536	347.7993424	Raw	distance greater than 100m
1119	761144	Hartford Ave	HARTFORD AVE	No Controls	route	Two-Way , Not Divided	Hartford Ave and Hartford Ave, Providence, RI, USA	41.81843	-71.45779	41.829423	-71.5357282	6580.156901	Not yet determined	distance greater than 100m
1116	761448	DOUGLAS AVE	DOUGLAS AVE	No Controls	intersection	Two-Way , Not Divided	Douglas Ave and Douglas Ave, Providence, RI, USA	41.84775	-71.43098	41.8715442	-71.4649957	3869.035717	Raw	distance greater than 100m
1111	761879	DORRANCE ST.	FOUNTAIN ST	Traffic Control Signal	intersection	Two-Way , Not Divided	Dorrance St. and Fountain Street, Providence, RI, USA	41.8349	-71.41676	41.8249124	-71.4146249	1125.831358	Not yet determined	distance greater than 100m
1110	762031	AMERICAN EXPRESS PLZ	EXCHANGE ST	Stop Signs	route	Two-Way , Not Divided	American Express Plz and Exchange Street, Providence, RI, USA	41.82833	-71.4132	41.8265115	-71.4118704	230.5294397	Not yet determined	distance greater than 100m
1095	765113	WESTMINSTER ST	SERVICE ROAD 8	No Controls	intersection	Two-Way , Not Divided	Westminster Street and Service Road 8, Providence, RI, USA	41.81919	-71.41791	41.816332	-71.4406099	1909.9366	Not yet determined	distance greater than 100m
1088	765576	ADMIRAL ST	HUXLEY AVE	No Controls	intersection	Two-Way , Not Divided	Admiral Street and Huxley Ave, Providence, RI, USA	41.83463	-71.41633	41.8467787	-71.4326586	1913.835392	Not yet determined	distance greater than 100m
1087	765854	SPICER ST	BERNARD ST	No Controls	intersection	Two-Way , Not Divided	Spicer Street and Bernard Street, Providence, RI, USA	41.79105	-71.40639	41.7905257	-71.4078253	132.6562424	Not yet determined	distance greater than 100m
1083	766752	FRANCIS ST	FOUNTAIN ST	Traffic Control Signal	route	Two-Way , Not Divided	Francis Street and Fountain Street, Providence, RI, USA	41.82489	-71.4145	33.9176699	-79.7489411	1143868.486	Not yet determined	distance greater than 100m
